,category,company,details,experience,industry,location,salary,title
72,Information Technology,FRG Technology Consulting,"
Software Engineer - Brookline, MA - $185K Must be a thought leader in big data technologies for an enterprise. You will be involved in strategic planning of a big data platform's maturity while focusing on cost, flexibility, and scalability. You will be drafting technology roadmaps to achieve the desired goals of the company. Must be able to work with managers and consultants to ensure that each implementation and forward progress of the project is monitored, analyzed, and integrated properly. Qualifications 
Development experience in one or more of the following languages: Python, Scala, Java

Experience in Scrum Methodology or other Agile environments
Hands on with GitHub and GitLab
Knowledge of the AWS ecosystem
Familiarity or experience with Test Driven Development
Experience with Web Server Configurations such as JBOSS and Tomcat
Familiarity with Big Data applications (Hadoop, Spark, HDFS, Accumulo)
Role
You will be responsible for designing, developing, testing, and debugging large scale software products, and make significant enhancements to existing software
You'll work on customer-facing web applications
Using cutting-edge open source frameworks
Highly-available RESTful services
Work with product owners to understand desired application capabilities and testing scenarios
Agile teams 
If you or someone you know is interested in this position, please send your resume directly to [Click Here to Email Your Resumé] or call 212-731-8282. My client is looking to start the interview process as soon as possible.FRG Consulting is a leader in Niche IT Recruitment with a focus on cloud technologies including Azure & AWS, as well as Big Data, Data Science and BI. We deal with both Microsoft Partners, AWS partners & End Users throughout North America. We have open positions and relationships with some of the top partners and end users throughout the US and offer some excellent opportunities in the BI, Big data space.I understand the need for discretion and would welcome the opportunity to speak to any Big Data and cloud analytics candidates that are considering a new career or job either now or in the future. Confidentiality is of the upmost importance. For more information on available BI jobs, as well as the Business Intelligence, Big data and cloud market, I can be contacted at 212-731-8282. Please see www.frgconsulting.com for more information.Big Data / Data Science / Hadoop / Microsoft Business Intelligence / BI / Business Intelligence / SSRS / SSAS / SSIS / SQL / T-SQL / MDX / Azure / Cloud / AWS / Data Warehouse / ETL / Power BI / Architect / Big Data / Hadoop / Scala / Python / Apache / Hive / Spark

Big Data / Data Science / Hadoop / Microsoft Business Intelligence / BI / Business Intelligence / SSRS / SSAS / SSIS / SQL / T-SQL / MDX / Azure / Cloud / AWS / Data Warehouse / ETL / Power BI / Architect / Big Data / Hadoop / Scala / Python / Apache / Hive / Spark
",NA,Computer Software,"Brookline, MA","$185,000.00 - $190,000.00 /Year",Business Intelligence
73,Information Technology,Experis,"
Irving TX18 month Contract$65 to $74 W2 or $70 to $78 C2C JOB SUMMARY Informatica Developer formulates and defines system scope and objectives through research and fact-finding to develop or modify moderately complex information systems. Prepares detailed specifications from which programs will be written. Designs, codes, test, debugs, documents, and maintains those programs. Works with users in the support of business applications. Uses professional concepts and company policies and procedures to solve a variety of problems. SSENTIAL DUTIES AND RESPONSIBILITIES include the following. Other duties may be assigned. Design, develop, and test data processes per business requirements, following the development standards and best practices as well as participate in code peer reviews to ensure our applications comply with best practices Work with Business analysts to gather business requirements from end users and translate them into technical specifications. Gather requirements to define data definitions, transformation logic, and data model logical and physical designs, data flow and process. To be responsible for providing technical guidance / solutions Provide estimates for development Perform data analysis and data profiling against source systems and data warehouse Designs data marts to support Business Intelligence reporting. Designs ETL processes using Informatica Power Center Assists developers with difficult Oracle PL/SQL code needed for queries, triggers, and stored procedures Design, develop, implement and maintain custom oracle applications written in PL/SQL. Conducts reviews of developed code Test solutions to validate whether requirements have been met; develop test plans, test scripts, and test conditions based on the business and system requirements Provide end-user support in post-deployment phases; assess and evaluate all feedback to ensure that the requirements necessary to correct issues are addressed. Provide on-call and after hours support for production systems. Must be an experienced Senior ETL Developer. Must already be sufficiently competent in dimensional data modeling to design data warehouses and data marts. Knowledge of slowly changing dimensions, partitioning, and basic data warehousing concepts. Ability to help create and map business needs/application requirements to technical solutions Development experience must be full Life Cycle experience including business requirements gathering, data sourcing, testing/data reconciliation, and deployment within Business Intelligence/Data Warehousing Architecture. Must have specific Development Life Cycle Methodology experience and have used it in multiple project deliveries. Experience and expert in complex ETL development, testing and implementation using Informatica Experience of working with high data volume and strict performance requirements Experience writing advanced SQL queries, PL/SQL Stored procedures, Functions & Packages Basic UNIX shell script experience required. Experience of working with high data volume and strict performance requirements Proficiency using Toad or equivalent developer tools Experience troubleshooting issues across different technologies including Business Objects. Exceptional debugging skills Excellent verbal/written communication and effective interpersonal skills to work with user community. Possess strong analytical, problem-solving, and organizational skills Ability to work independently and in a team environment, in order to achieve personal and team goals and complete assignments within established time frames. Experis is an Equal Opportunity Employer (EOE/AA)
",NA,Computer Software,"1231 Greenway DriveIrving, TX 75038",$65.00 - $74.00 /Hour,Business Intelligence
74,Information Technology,"Beacon Hill Staffing Group, LLC","
Position OverviewA Beacon Hill client is looking for results oriented, Senior Technical Analyst to execute ETL support, enhance, and project activities within the organizations IT Information Management Analytics Services organization. As a Senior Technical Analyst, this individual will be a self-starter and team player, and will be responsible to fulfill the following roles drawing on substantial experience from their Business Intelligence and/ or Data Warehouse background: data analyst, ETL designer, data modeler, ETL developer, and ETL Tester. This person will collaborate and communication closely with IT IMAS team, managers, project managers, leads, architects, report developers, and ETL developers, as well as other IT and business stakeholders.ResponsibilitiesDrawing upon project inputs, including scope and requirements documents:
Create effective ETL support and project documentation, including data analyses, ETL mappings, data models, ETL unit test plans, ETL integration test plans, and migration/ deployment plans
Negotiate and prioritize product functionalities and designs with project teams and stakeholders

Perform data analyses, create ETL mappings, create data models, develop ETL processes, execute unit test plans and document results, execute integration test plans and document results, and coordinate migrations and implementations
Provide on-call support and work remotely, as needed
Maintain regular and predictable attendance
Demonstrated ability to quickly learn and develop in new ETL/ ELT technologies
Perform other duties as assigned
Requirements
Ability to work well in a team environment, including remote teams; strong interpersonal skills
Strong oral and written communication skills
Strong problem-solving, analytical, and critical thinking
8+ years Informatica experience
8+ years Data Warehouse experience, including dimensional modeling (Kimball)
8+ years of IT experience
5+ years of Data Analysis experience
5+ years of Oracle and Oracle PL/SQL
5+ years of SQL Server and T/SQL
Bachelor's degree or equivalent experience
Preferred: 
Insurance and/or reinsurance industry knowledge
Master's degree and/or LOMA certification
Experience as an ETL team lead 
Technical Skills:
Informatica Power Center and Data Validation Option (DVO)
Tidal Enterprise Scheduler
Oracle PL/SQL
TOAD
UNIX Scripting
Erwin Data Modeler
Vertica
Tableau
MS BI Stack, including SSRS, SSAS, SSIS, SSMS, and SQL Server
Talend
MS Office
MS Visio
PostgreSQL
Find Us on Facebook!Follow Us on Twitter!Beacon Hill is an Equal Opportunity Employer that values the strength diversity brings to the workplace. Individuals with Disabilities and Protected Veterans are encouraged to apply.Company Profile:Beacon Hill Technologies, a premier National Information Technology Staffing Group, provides world class technology talent across all industries on a contract, direct (permanent), contract-to-direct and project basis. Beacon Hill Technologies' dedicated team of recruiting and staffing experts consistently delivers quality IT professionals to solve our customers' technical and business needs. Beacon Hill Technologies covers a broad spectrum of IT positions, including Project Management and Business Analysis, Programming/Development, Database, Infrastructure, Quality Assurance, Production/Support and ERP roles.Learn more about Beacon Hill Staffing Group and our specialty divisions, Beacon Hill Associates, Beacon Hill Financial, Beacon Hill HR, Beacon Hill Legal, Beacon Hill Pharma and Beacon Hill Technologies by visiting www.beaconhillstaffing.com. We look forward to working with you.Beacon Hill. Employing the Future™
",8+ years,Healthcare - Health Services,"St. Louis, MO","$100,000.00 - $101,000.00 /Year",Business Intelligence
75,Information Technology,Signature Consultants,"
Power BI Developer Summary:Signature Consultants is looking for a Power BI Developer to work on a contract position with one of our clients located in Davie, FL. The Power BI Developer is required to have advanced knowledge of report and dashboard creation from DWH and OLAP cubes (SSAS) for this role.Requirements:
Power BI and Power BI DAX (Data Analysis Expression) Developer
Row Level Security to restrict access to different users based on roles and permissions
Data Modeling and T-SQL queries for relational and multidimensional databases
Query Performance and tuning
Nice to have Qualifications:
SSRS (SQL server reporting services)
Scrum methodology
Familiarity with Ticketing systems preferable System Center Service Manager
Four-year college degree in Computer Science, Management Information Systems (MIS), Mathematics, Industrial Engineering, or related field.
About Signature Consultants, LLCHeadquartered in Fort Lauderdale, Florida, Signature Consultants was established in 1997 with a singular focus: to provide clients and consultants with superior staffing solutions. For the seventh consecutive year, Signature was voted as one of the ""Best Staffing Firms to Work For"" and is now the 14th largest IT staffing firm in the United States (source: Staffing Industry Analysts). With 26 locations throughout North America, Signature annually deploys thousands of consultants to support, run, and manage their clients' technology needs. Signature offers IT staffing, consulting, managed solutions, and direct placement services. For more information on the company, please visit www.sigconsult.com.
",NA,"Computer Hardware, Computer Software","Plantation, FL",NA,Business Intelligence
76,General Business,Vaco Technology,"
DescriptionGreat oppoutunity for the New Year!! Our client is seeking a Business Systems Analyst to proactively analyze data and review processes in the Supply Chain Management function. This role is responsible for creating reports and analyzing large datasets to reduce supply and inventory expenses, aid in product standardization, and streamline processes while ensuring the highest quality products for patient care. BS preferred, MBA is a plus. Proficiency in Lawson, Epic, and advanced Excel (Vlookup and Pivot Tables), SQL and Access functions is preferred. Healthcare, Supply Chain, Inventory or Clinical background is a plus. Experience with BI (Business Intelligence) and SharePoint preferred. Position RequirementsEducation RequirementsBachelor's Degree preferred.MBA a plusExperience and Skills*Advanced Microsoft Excel skills including v look ups and pivot tables. (Required)*Advanced Microsoft Access skills. (Preferred)*Advanced understanding of the Lawson and QSight Procurement Systems. (Preferred)*Must be a self-starter, self-motivated, and customer service oriented.*Strong critical thinking and analytical skills.*Strong facilitation and excellent verbal and written communication skills.*Detail oriented with strong organizational skills.
",NA,Healthcare - Health Services,"West Reading, PA 19611","$63,000.00 - $80,000.00 /Year",Business Intelligence
77,Information Technology,DISYS,"
Position Summary: Immediate need for a Senior Business Analyst.  Candidates should be able to demonstrate competency across all areas of business analysis. Responsibilities of the Business Analyst include enabling revenue growth by conducting market research and business intelligence analysis to validate B2B integration strategies.  The Business Analyst will also lead the solution analysis definition for reporting and business intelligence services. Additional responsibilities for the Business Analyst include maturing the business analyst discipline by mentoring less experienced business analysts and leading initiatives to improve onboarding and career development. •    Lead solution analysis, definition , and acceptance in application development lifecycle (including technology possibilities and limitations)  •    Gather, interpret, and translate customer needs into functional and nonfunctional requirements – translate business problems into requirements that facilitate application development  •    Analyze and assess data usage and product performance for maintenance prioritization and compliance with service level agreements Experience with Tableau or SAS is greatly preferred.  Apply now!  

Digital Intelligence Systems, LLC. is an Equal Opportunity Employer, M/F/D/V. We do not discriminate against any employee or applicant because they inquired about, discussed, or disclosed compensation. Email recruitinghelp @ disys.com to contact us if you are an individual with a disability and require accommodation in the application process.
",NA,Transportation,"Cary, NC",$40.00 - $50.00 /Hour,Business Intelligence
78,"Finance, General Business, Information Technology",Securitas EOC,"
Our Eastern Operations Center in Parsippany, NJ is currently recruiting for a Technical Business Analyst. As a Technical Business Analyst, you will have responsibility for capturing business data, building business models, and processing solutions to address business needs.In this role, you will gather data, identify structure and context, extrapolate the insights and create reports. Produce financial, market and operational analysis by querying data repositories and generating periodic reports. Devise methods for identifying data patterns and trends in available information sources. Provides reports on financial and performance measures on both a recurring and ad-hoc basis.Functions:
Technical expertise regarding data models, database design development, data mining and segmentation techniques
Developing database solutions to store and retrieve company information
Extract data from databases and data warehouses for reporting and to facilitate sharing between multiple data systems
Assist in the design and development of data warehouses and other database components to support Business Intelligence dashboards and reporting
Provide recurring and ad-hoc reports as required on financial and performance measures;
Strong analytical skills with the ability to collect, organize, analyze, and disseminate significant amounts of information with attention to detail and accuracy
Analyzes and interprets financial and operating data for management including performance benchmark reporting, cost analyses, market niche reporting, profitability analyses, performance assessments, contract pricing analyses, wage analyses, and other reporting as required
Acquire data from primary or secondary data sources and maintain databases/data systems
Standardize data collection by developing methods for database design and validation reports
Synthesize current business trends or data to support recommendations for action
Analyzes and interprets trends; identifies and communicates loss trends; recommends corrective actions to stem immediate shortfalls while addressing long-term profitability issues.
Oversees and coordinates financial programs for funding new and continued operations in order to increase productivity and maximize profitability
Provide application analysis and data modeling design to collect data for a centralized data warehouse.
Locate and define new process improvement opportunities
Work with team members and functional leads to understand existing data requirements and validation rules to support moving operational data into data warehouse
Other duties as assigned by management
Education/Experience:
Bachelor's degree in computer science or a related field, and a minimum of three years progressively responsible business experience or an equivalent combination of education and experience sufficient to perform the essential functions of the job, as determined by the company
Strong knowledge of and experience with reporting packages (Business Objects etc) and databases (SQL etc)
Programming language (JAVA, Python, Ruby, XML, Java, ETL frameworks, VBA)
Competencies :
Strong understanding of business intelligence tools, databases, systems and methods
Skill in financial and operational analysis
Demonstrated knowledge of ethical business practices
Ability to think strategically, synthesize complex business/financial data and develop solutions
Ability to interact effectively at all levels and across diverse cultures
Ability to be an effective member of complex project teams
Ability to use financial systems and standard office applications software effectively
EOE M/F/Vet/DisabilitiesBenefitsMedical, dental, and vision coverage offered, along with 401k and life insurance.
",NA,"Accounting - Finance, Computer Software","9 Campus DriveParsippany-Troy Hills, NJ 07054","$70,000.00 - $80,000.00 /Year",Business Intelligence
79,Information Technology,Frank Recruitment Group,"
Big Data Engineer - Alexandria, VA - $180K My client is looking for an enthusiastic Big Data Engineer to work in improving their business and streamlining efficiency. The role involves working with Spark, Scala, Python, and Hadoop on an AWS big data cloud platform. It is critical that this Engineer have an understanding of full lifecycle projects and has experience working on projects from proof of concept to delivery and implementation. The engineer will be involved in the development, implementation, and analysis of the cloud based project.Big Data Engineer - Alexandria, VA - $180K Required Experience & Qualifications:
Extensive experience in big data tools and data warehouse design
Experience scripting with Scala on Spark

Proven familiarity with AWS; certification a plus Extensive knowledge and implementation of Hadoop platform and environment; Hortonworks, Cloudera, Zookeeper are a plus
Proven experience using AWS tools such as EMR, EC2, S3
Long term experience using Redshift
Experience with one or more of the following: Java, Python, Hive, Oracle
Comprehensive experience in the big data space
Role & Responsibilities:
Use understanding of big data concepts to fully design and communicate project goals
Be able to communicate technically and non-technically to higher management
Recognize how to best use AWS and Hadoop to achieve desired result while keeping budget and requirements in mind
Provide highly technical and strong managerial leadership to a team
Benefits & Bonus
Competitive base and bonus
Full medical/health
Opportunity to work with the newest technology in the industry
Company Match 401k program
Remote work
Exciting company culture
If you or someone you know is interested in this position, please send your resume directly to [Click Here to Email Your Resumé] or call 212-731-8282. My client is looking to start the interview process as soon as possible.FRG Consulting is a leader in Niche IT Recruitment with a focus on cloud technologies including Azure & AWS, as well as Big Data, Data Science and BI. We deal with both Microsoft Partners, AWS partners & End Users throughout North America. We have open positions and relationships with some of the top partners and end users throughout the US and offer some excellent opportunities in the BI, Big data space.I understand the need for discretion and would welcome the opportunity to speak to any Big Data and cloud analytics candidates that are considering a new career or job either now or in the future. Confidentiality is of the upmost importance. For more information on available BI jobs, as well as the Business Intelligence, Big data and cloud market, I can be contacted at 212-731-8282. Please see www.frgconsulting.com for more information.Big Data / Data Science / Hadoop / Microsoft Business Intelligence / BI / Business Intelligence / SSRS / SSAS / SSIS / SQL / T-SQL / MDX / Azure / Cloud / AWS / Data Warehouse / ETL / Power BI / Architect / Big Data / Hadoop / Scala / Python / Apache / Hive / Spark

Big Data / Data Science / Hadoop / Microsoft Business Intelligence / BI / Business Intelligence / SSRS / SSAS / SSIS / SQL / T-SQL / MDX / Azure / Cloud / AWS / Data Warehouse / ETL / Power BI / Architect / Big Data / Hadoop / Scala / Python / Apache / Hive / Spark
",NA,Computer Software,"Alexandria, VA","$180,000.00 - $190,000.00 /Year",Business Intelligence
