,category,company,details,experience,industry,location,salary,title
136,"Automotive, Engineering, Manufacturing",Snelling Staffing Services,"
Engineering AnalystAttention all Mechanical Engineering graduates: Are you a continuous improvement guru that wants to be involved in the exciting and growing automotive industry? Do you have an eye for detail and love making sure your products are the best? If you would like the chance to join an international supplier to many of the top automotive manufacturers then we want to hear from you! Check out this amazing opportunity and apply!Company Information:
An established supplier having a global footprint that has been in business for nearly 100 years and has been local to Alabama for over 14 years.
Annual sales of $15million and has displayed continual growth.
The culture is all about putting out a quality product. They have just under 100 employees and everyone takes ownership of their role in the company.
Benefits, Pay, and Features:
Health insurance through BCBS, Dental, Short-term & Long-term Disability, Life Ins., 401k, Tuition Reimbursement
Paid Time Off Increases w/ tenure
10 paid holidays
Pay is competitive and ranges around $35-40k depending on exp.
Other various perks
Engineering Analyst's role with the Company:The Engineering Analyst's role within the company will be of high importance and will report to the Senior Manager in the Operations department. You will work closely with your team to perform machine improvements, Kaizen events, and other continuous improvements. Your responsibilities include but are not limited to:
Contribute to the rationalization of strategic capital investment planning and budgeting financial investment projects.
Promote safe work practices and achieve objectives for ergonomics, health and safety and 5S.
Maintain awareness of quality standards, communicate department quality goals and leverage resources to solve quality problems.
Strong problem-solving skills (utilizing data). Implement/follow systems that prevent reoccurrence of known issues.

Assist to achieve production schedules and product requirements by applying lean manufacturing principles with emphasis on variation reduction.
Control costs and achieve productivity improvements.
Demonstrated knowledge and ability to implement and apply Nitto's Kaizen principles to both operations and maintenance.
Complies with all company policies, procedures, and handbooks.
The work environment characteristics described here are representative of those an Engineering Analyst can encounter while performing the essential functions of this job. Reasonable accommodations may be made to enable individuals with disabilities to perform the essential functions. While performing the duties of this job, the Associate is frequently exposed to moving mechanical parts or airborne particles. The noise level in the work environment is usually quiet.Background Profile of Engineering Analyst:
Associates Degree, 2-year Technical/Mechanical Certification/Diploma and/or Bachelor's Degree.
Working knowledge and efficiency in AutoCAD 3D
Prefer at least 1 year of experience in a manufacturing engineer role
High level of interpersonal skills to effectively lead, motivate and facilitate others in group situations. Proficiency in team building and ability to create an environment that allows for measured risk-taking.
Ability to effectively organize and plan.
Well-developed oral and written communication skills with the ability to work effectively with all levels of the organization.
High-level of analytical ability to assess and identify appropriate alternative courses of action for definition and resolution of problems that are unique and diverse; Ability to exercise independent judgment is required.
Knowledge of financial management concepts to improve costs.
Interested and qualified? You can apply directly below. Snelling, with over 60 years of staffing expertise, specializes in clerical, administrative, professional and industrial positions, permanent and temporary. There's never a fee or contract to our candidates! Snelling is an Equal Opportunity Employer and a drug-free workplace.
",14 years,"Automotive - Motor Vehicles - Parts, Manufacturing","Jasper, AL","$35,000.00 - $40,000.00 /Year",Business Intelligence
137,Information Technology,Advanced Resources,"
Job Number: 458843Peoplesoft Technical LeadWe have a client in the Western Suburbs in high growth mode, having opened in 3 countries last year. The Peoplesoft Technical Lead is a newly created position, and there's tons of room for career advancement.  In this role, you will have responsibility over technical solution design, development, deployment, and implementation - covering all technical aspects of the PeopleSoft implementation lifecycle.   Responsibilities:
Code, test, debug, implement, and document programs. 
Designs Systems and programs to meet complex business needs
Ensures programs meet standards and technical specifications; performs technical analysis and component delivery
 Required Skills:
5+ years' experience with the PeopleSoft Financial modules AP, AR, BI, and GL application fundamentals 
Must have hands-on experience with Peoplesoft Tools 8.5x, Application Designer, Component Interface, Application Engine, SQR, SQL, Integration Broker, PS Query, and other integration technologies
Must also be able to work with the business users and client management in applying functional knowledge within those same modules
Must have excellent written and verbal communication skills

",5+ years,Computer Software,"Willowbrook, IL","$100,000.00 - $120,000.00 /Year",Business Intelligence
138,Information Technology,Kforce Technology,"
RESPONSIBILITIES:Kforce has a client seeking a Senior Business Intelligence Developer in Sarasota, Florida (FL).Summary:This position requires in-depth knowledge of the core concepts of Kimball data warehousing and Microsoft business intelligence reporting and analytics. This is an end to end data solutions delivery position which includes ETL development, reporting, dashboard and visualization development, data analysis and production support of delivered solutions.Essential Duties:
 Responsible for the design, development and implementation of Business Intelligence solutions in an Agile Development environment using the Microsoft BI Stack on SQL Server 2016 Enterprise (SSIS, SSRS, SSAS and Power BI)
 Develop data warehouse systems to support reporting and analytics using SSRS and Power BI
 Develop ETL processes using SQL and SSIS
 Demonstrate collaborative skills working within an Agile project team
 Identify opportunities in business processes, system capabilities and delivery methodologies for continuous improvement with an emphasis on DevOps
 Evaluate existing systems and help define the ETL processes for transforming data from heterogeneous source systems to a data warehouse
 Maintain technical documentation for Business Intelligence processes



REQUIREMENTS:
 Bachelor's degree in Computer Science, Engineering, Mathematics or related area
 Microsoft certifications in SQL Server or BI Stack a plus
 5+ years of experience developing reporting and analytics solutions with Microsoft SQL Server 2012 or higher version
 5+ years of experience using T-SQL to build stored procedures, views, functions
 5+ years of experience developing ETL processes with SSIS in a data warehouse environment
 5+ more years of experience building reports with SSRS
 Experience working in an Agile development environment
 Knowledge of data quality, data profiling and data cleansing techniques
 Excellent listening skills, interpersonal skills, ability to analyze data and test data against business rules
 Experience with in-memory data visualization tools such as Power BI, QlikView or Tableau a plus
 Experience with working in a cloud environment such as AWS or Azure a plus
 Experience working in the Financial Services or Retail industry a plus

Kforce is an Equal Opportunity/Affirmative Action Employer. All qualified applicants will receive consideration for employment without regard to race, color, religion, sex, pregnancy, sexual orientation, gender identity, national origin, age, protected veteran status, or disability status.
",5+ years,Accounting - Finance,"Sarasota, FL 34232",NA,Business Intelligence
139,"Admin - Clerical, Engineering, QA - Quality Control",Amtec,"
Loss Prevention Analyst
Tustin, CA 6 - 8 months
Their primary function will be to investigate any delivery shortages and document their findings.
The ideal candidate will ensure compliance with distribution procedures by investigating potential shortage issues that are reported through our drivers. They are responsible for identifying internal or external theft activity by using all investigative resources available, i.e., remote monitoring, exception reporting, store and system reports, internet surveillance, GPS Tracking and physical surveillance, etc. Maintain accurate records of all identified theft activity and related follow up; disseminate and communicate reporting as necessary. Will assist the Loss Prevention Department in any other Loss Prevention tasks during down time.



Qualifications:

Solid working knowledge of MS Office (MS Word, MS Excel, MS Power Point, etc.).
Former auditing experience with the ability to write detailed reports on findings.
CPG (Customer Packaged Goods) Industry knowledge preferred
General knowledge and understanding of distribution channels, structure and processes.
Thorough knowledge of effective investigation techniques and methodologies.
Working knowledge of Avigilon Surveillance system and or other camera systems. 
Ability to work independently.

",NA,"Retail, Energy - Utilities - Gas - Electric, Industrial","Tustin, CA",$25.00 - $28.00 /Hour,Business Intelligence
140,Other,ACT,"
OverviewACT is a nonprofit organization helping people achieve educational and workplace success.  Our programs are designed to boost lifelong learning in schools and workplaces around the world. Whether it's guiding students along their learning paths, enabling companies to develop their workforce, fostering parent, teacher, and counselor understanding of student progress, guiding job seekers toward career success, or informing policymakers about education and workforce issues. ACT is passionate about making a difference in all we do.Learn more about working at ACT at act.org!Responsibilities The Business Intelligence Developer I works within a team to design, analyze, test, and implement business intelligence (BI), analytics, and enterprise reporting solutions.  This position serves as a BI subject matter expert assisting business users in accessing their needs and mapping those needs to appropriate back-end solution architectures (i.e., OLTP/transactional databases, data marts, data warehouses, local data sources, etc.)Typical work-related activities include: Scope, develop, and deliver new business intelligence and analytics solutions, including static/dynamic dashboards, and interactive reports, charts, and graphs based on customer needs and inputs Collaborate with end users to identify needs and opportunities for improved data management and delivery Work with stakeholders across organization to build knowledge of the organization, products, and processes in order to understand where opportunities for BI may add value Provide user and production support when necessary Work as part of a Scrum team, requiring communications with team and others across the organization
QualificationsEDUCATION:  Bachelor's degree in Computer Science, Information Systems or related technical discipline required Or an equivalent combination of education and experience from which comparable knowledge and abilities can be acquired
EXPERIENCE: Minimum of one year of solid Business Intelligence Enterprise Reporting experience including database skills such as SQL, PL/SQL, or Oracle RDBMS Experience with Data Visualization tools (e.g. Tableau), SAS, R, Oracle Reports, Oracle Discoverer, Oracle Business Intelligence Enterprise Edition (OBIEE) suite of applications, Zeppelin, Python, Unix, Java Development, or web services preferred Experience with Big Data and NoSQL technologies such as Mongo DB or Hadoop desired
KNOWLEDGE, SKILLS, AND ABILITIES: Excellent communication and interpersonal skills Strong analytical, problem solving, and time management skills in an operational environment Foundational understanding of the software lifecycle and software engineering best practices, including specification, documentation, configuration management, testing, and quality assurance Familiarity with Agile or Lean programming practices and methodologies and ability to apply them Ability to maintain knowledge of new technologies and to apply them Demonstrated ability to work independently, prioritize individual work load, troubleshoot, and remedy problems under pressure
COMPENSATION:  Starting salary commensurate with qualifications. Excellent benefits and work environment. 
",NA,"Education - Teaching - Administration, Not for Profit - Charitable","Iowa City, IA",NA,Business Intelligence
141,Information Technology,Frank Recruitment Group,"
Software Engineer - Medford, MA - $185K Must be a thought leader in big data technologies for an enterprise. You will be involved in strategic planning of a big data platform's maturity while focusing on cost, flexibility, and scalability. You will be drafting technology roadmaps to achieve the desired goals of the company. Must be able to work with managers and consultants to ensure that each implementation and forward progress of the project is monitored, analyzed, and integrated properly. Qualifications 
Development experience in one or more of the following languages: Python, Scala, Java

Experience in Scrum Methodology or other Agile environments
Hands on with GitHub and GitLab
Knowledge of the AWS ecosystem
Familiarity or experience with Test Driven Development
Experience with Web Server Configurations such as JBOSS and Tomcat
Familiarity with Big Data applications (Hadoop, Spark, HDFS, Accumulo)
Role
You will be responsible for designing, developing, testing, and debugging large scale software products, and make significant enhancements to existing software
You'll work on customer-facing web applications
Using cutting-edge open source frameworks
Highly-available RESTful services
Work with product owners to understand desired application capabilities and testing scenarios
Agile teams 
If you or someone you know is interested in this position, please send your resume directly to [Click Here to Email Your Resumé] or call 212-731-8282. My client is looking to start the interview process as soon as possible.FRG Consulting is a leader in Niche IT Recruitment with a focus on cloud technologies including Azure & AWS, as well as Big Data, Data Science and BI. We deal with both Microsoft Partners, AWS partners & End Users throughout North America. We have open positions and relationships with some of the top partners and end users throughout the US and offer some excellent opportunities in the BI, Big data space.I understand the need for discretion and would welcome the opportunity to speak to any Big Data and cloud analytics candidates that are considering a new career or job either now or in the future. Confidentiality is of the upmost importance. For more information on available BI jobs, as well as the Business Intelligence, Big data and cloud market, I can be contacted at 212-731-8282. Please see www.frgconsulting.com for more information.Big Data / Data Science / Hadoop / Microsoft Business Intelligence / BI / Business Intelligence / SSRS / SSAS / SSIS / SQL / T-SQL / MDX / Azure / Cloud / AWS / Data Warehouse / ETL / Power BI / Architect / Big Data / Hadoop / Scala / Python / Apache / Hive / Spark

Big Data / Data Science / Hadoop / Microsoft Business Intelligence / BI / Business Intelligence / SSRS / SSAS / SSIS / SQL / T-SQL / MDX / Azure / Cloud / AWS / Data Warehouse / ETL / Power BI / Architect / Big Data / Hadoop / Scala / Python / Apache / Hive / Spark
",NA,Computer Software,"Medford,MA","$185,000.00 - $190,000.00 /Year",Business Intelligence
142,"Banking, Accounting",TalentBridge,"
This position is a Capital Markets Analyst on the Operations Risk and Control Team, supporting Regulatory Risk for securities operations. This individual will work closely with Compliance and Regulatory Relations of the company to develop working relationships and represent operational processes, improvements, and impact. The individual will also partner with Legal, Audit, Business Management, Project Management, Finance, Technology, and others to connect Operations to the organization’s goals and provide feedback on impact to Operations from those changes. The candidate will need to provide clear directions to Operations on current and upcoming regulations. The candidate will use industry and regulatory knowledge to guide Operations through its industry implementation committees, steering committees, and implementation groups on behalf of Wells Fargo based on feedback from Operations partners, and disseminate clear information back to operations from these groups.

Desired Skills: • Extensive knowledge and understanding of loan, securities, and derivative products • Intermediate Microsoft Office skills • Excellent verbal, written, and interpersonal communication skills • Effective organizational, multi-tasking, and prioritizing skills • Ability to work in a fast-paced deadline driven environment • FINRA registration including Series 99 or 7 (or FINRA recognized equivalents) Other Desired Qualifications • A BS/BA degree or higher in accounting, finance, or economics. • 10+ years’ experience in the financial services industry, at least 7 of which should be in Operations or functions such as Compliance or Operational Risk supporting Operations • Thorough understanding of regulations as they apply to a Swap Dealer Broker-Dealer, Prime Broker, and/or FCM from an Operations perspective. This includes CFTC, SEC, FINRA, MSRB and SRO rules and regulations. • Thorough understanding of Derivatives, Fixed Income, Equities, and Debt Securities is mandatory. • Detailed knowledge of regulations affecting a Swap Dealer, Broker Dealer, Prime Broker, or FCM from and international (Non-US) perspective. • Participation in audits impacting the Operations division of a 'globally systemically important bank'. • Experience partnering with Operations to properly implement regulatory changes and providing guidance to Operations for seamless compliance. • Experience challenging the status quo while maintaining relationships with business partners. • Experience with large-scale implementations impacting multiple asset-classes and divisions. • Strong candidates will possess superior ability to organize verbal and written communication to clarify purpose and importance, stress major points, and follow a logical sequence. • Candidates are proficient with business concepts, including operations risk and controls, meticulous with detail and capable of independently suggesting controls or improvements. • Candidates should be able to work effectively in a demanding, fast-paced, dynamic environment, handling multiple tasks and projects concurrently, while maintaining the highest standard of excellence
",NA,Banking - Financial Services,"Charlotte, NC",$75.00 - $85.00 /Hour,Business Intelligence
143,Information Technology,Uline,"
Sr. Business Intelligence Developer


Uline – Shipping Supply Specialists

""The people I work with are as passionate as I am."" 
""I came to Uline for a job. Instead, I found a career."" 

Uline is North America's leading distributor of shipping, packaging and industrial supplies. We're a family-owned company known for our incredible customer service and quality products. Our people make the difference.

We're looking for the best and brightest to take our IT department to the next level. If you have passion and expertise in Java and .NET development, database modeling, business systems analysis, or solution architecture, Uline is the company for you.


Uline seeks a Sr. Business Intelligence Developer at its Corporate Headquarters in Pleasant Prairie, Wisconsin (south of Milwaukee).

SR. BUSINESS INTELLIGENCE DEVELOPER RESPONSIBILITIES

Design and develop enterprise and departmental business intelligence, data warehousing and reporting solutions.
Work with business users to establish reporting and analytic requirements.
Translate business requirements into ETL and report specifications.
Develop and implement ETL processes, reports and queries in support of business analytics.
Develop and implement interactive analytic reports and dashboards.
Provide technical and business knowledge support to the team.
Compile ad-hoc data and report requests.
Ensure effective communication of user requirements. 


SR. BUSINESS INTELLIGENCE DEVELOPER MINIMUM REQUIREMENTS

Bachelor's degree in IT or related major.
5+ years related experience.
Excellent knowledge of database design, SQL, data warehousing and IBM Cognos BI.
Strong knowledge of Microsoft BI technology (SSRS, SSIS, SSAS).
Ability to facilitate meetings and delegate responsibilities.
Available for travel to Uline's domestic and international branches.


SR. BUSINESS INTELLIGENCE DEVELOPER BENEFITS 

Complete insurance coverage – medical, dental, vision, life. 
401(k) with company match. 
Generous paid time off. 
Tuition reimbursement. 
3 bonus programs.


Please visit www.uline.jobs to learn more about our job openings and benefits package.


HOW TO APPLY

Please click the “APPLY"" button to submit your resume for immediate consideration! 

EEO/AA Employer/Vet/Disabled
Uline is a drug-free workplace
Skills Requirements: 
MIS, INFORMATION TECHNOLOGY, SENIOR BUSINESS INTELLIGENCE DEVELOPER, SR. BUSINESS INTELLIGENCE DEVELOPER, BUSINESS INTELLIGENCE, DATA WAREHOUSING, ETL, SQL, DATABASE DESIGN, IBM COGNOS, COGNOS, COGNOS BI, IBM COGNOS BI, BI, SSRS, SSIS, SSAS, MILWAUKEE, RACINE, KENOSHA, LAKE COUNTY, WAUKEGAN
",5+ years,"Office Supplies - Equipment, Packaging, Retail","Pleasant Prairie, WI 53154",NA,Business Intelligence
